{
  "schemaVersion": 2,
  "id": "luna",
  "model": "gpt-6-luna",
  "reasoning": "medium",
  "webSearch": "live",
  "timeoutSeconds": 900,
  "commandTimeoutSeconds": 120,
  "maxTurns": 4,
  "maxCorrectiveTurns": 2,
  "operationCategories": [
    "build",
    "unit-test",
    "integration-test",
    "cli-check",
    "http-check"
  ],
  "maxOperationCalls": 24
}
